{"adjudication":{"blind_arm_labels":true,"cold_primary_evidence":true,"evidence_ref":null,"independent_panel_registered":false,"judge_packet_sealed":false,"tie_rule_registered":false},"allowed_actions":["Only actions in the future signed hermetic case scope."],"analysis_plan":"paired_case_deltas_exact_counts_publish_all_cases_no_unplanned_peeking","arms":[{"blind_label":"arm-x","source":{"commit":"34351f0431ed5d1faa04b6237961ca89abdebecb","files":[{"path":"engine/loop.md","sha256":"sha256:f157386d9fd20cfa85508d016db702a383da2c25e9b87c308175f06d69c6977a"},{"path":"engine/persistence.md","sha256":"sha256:36993322e676cbcc8ed1c20763ac665250c4a9a5c5e9bcab5e28c2024419d031"},{"path":"engine/pocinator.md","sha256":"sha256:13809386b752b1bb20176134b7d73cc7a5f92547eee2f9340aff4d86ef62ceec"},{"path":"engine/regrade.md","sha256":"sha256:0ba58974b8073d2b760c656013b07e9e525c0792a3ece28dcd4a595275bc9f7e"},{"path":"engine/routing.md","sha256":"sha256:3a4345b3dfb325528842f9937a92311c558af91d643db154cf764152935e48b2"},{"path":"schemas/attempt.schema.json","sha256":"sha256:d504b5cd9786354e59d7c98c4a18b0a8d5e52cdf0eca018fe48ac0a8bbbb888b"},{"path":"schemas/finding.schema.json","sha256":"sha256:51cc94678a1954943ab891987a3f8f1096c15acb7f71a5a657947c88a1a2a6ad"}],"git_tree":"641b2d6a5d286d61241c66601bd188ad41b072aa","tree_hash":"sha256:ed99e9bbc7193d5a7fbdc989a9b543daae97c0678e48dacd48d7014b80c3158a"},"treatment":"staged_baseline"},{"blind_label":"arm-y","source":{"commit":"ee8e265c2d4b5a661b7da667805b05e1a9e67a83","files":[{"path":"engine/loop.md","sha256":"sha256:01d86e01d7c2266a13fc46bd76601b0574c2a212eb9de1d366410f242bdf782a"},{"path":"engine/persistence.md","sha256":"sha256:4fae97f3dfc136d58d208c5786876ce4c88676d6a6204046ee6ad0fb397eb6dc"},{"path":"engine/pocinator.md","sha256":"sha256:6624e9ed7b67382c2d3fb6220aa293212523c28654eabfd7c63a53622538f2e0"},{"path":"engine/regrade.md","sha256":"sha256:ff8863c3ea4163ed4c848a9d696fa49176851ce49495e0ae90551d4ec6b7b145"},{"path":"engine/routing.md","sha256":"sha256:3a4345b3dfb325528842f9937a92311c558af91d643db154cf764152935e48b2"},{"path":"schemas/artifact.schema.json","sha256":"sha256:f8ac5ff5c13e77db5e103aa0f6b4671d88522944eb977a48832f6d7bbc1a9349"},{"path":"schemas/attempt-v2.schema.json","sha256":"sha256:26b6d936e2f89cf16ee01701ddace88fbf4279ae9e695716cb6debd8cd02c271"},{"path":"schemas/engagement-event.schema.json","sha256":"sha256:621c5959db986639cc11393a8ad0c4274bfb834eb980eab6080ab16604d92955"},{"path":"schemas/environment-preflight.schema.json","sha256":"sha256:00f22fdc9b7f360dde0d293d6215313484f5ffa869661530090dcdca2ee694f8"},{"path":"schemas/finding-v3.schema.json","sha256":"sha256:013b0234e41067e0ff5f77dccb63ded73077ac9cf209a70e106bd9ae56c6a423"},{"path":"schemas/memory-disposition.schema.json","sha256":"sha256:14485db62fae90b4de8808329334d2239498584b7b60faaf71d845ef159a4bf6"},{"path":"schemas/report-manifest.schema.json","sha256":"sha256:73034f27f363add11b3add97cadb4f6dec0017a734e66a66cfa6b96d71b6d5bd"},{"path":"schemas/research-telemetry.schema.json","sha256":"sha256:c20ff2be8a02e66d5ec26a45936ae29fd156b7026fedb7e1f54e784fe1fca63f"},{"path":"schemas/review.schema.json","sha256":"sha256:fd37d233463ba509d7b12b94bec7c9bc1313b42d9ea02ebf46a4a07ae69123d6"},{"path":"tools/engagement_state.py","sha256":"sha256:2df5e76ba0ba6ddff03d210b739dabf6a1b7f10a69b3ef32a4c3a57390e3daaa"},{"path":"tools/environment_preflight.py","sha256":"sha256:d5e134b5841be4bfdb0b2adf3ed8c0dbffd14afa8087907e417641ee18b1284a"},{"path":"tools/memory_disposition.py","sha256":"sha256:f459abb1e1ef945c00de386e57fbf269df8736d99145c60556af4c362e31a4eb"},{"path":"tools/reporting.py","sha256":"sha256:876463955069ca55573e422683d59dae9bc510e30f37ffa2f34f83fccb9f9a72"},{"path":"tools/research_telemetry.py","sha256":"sha256:2e8483b2f5071e1e66254578bb307b57f5e2961bff923a2bf27c316f5642d881"},{"path":"tools/run-engagement.py","sha256":"sha256:60100b4d1a18b704dc7b303a9eef4f67af34e28217cfd6cf9e6ef9a0995e4ba3"}],"git_tree":"5266945506ca92efef2932f8563bbbfe836c384e","tree_hash":"sha256:37f0ae416fa39631a136164ec3e517cab9dbf1774275b8ed12c4fdae277aeb80"},"treatment":"decision_0005_kernel"}],"blocked_run_treatment":"publish_and_exclude_from_effect_imputation","case_isolation_plan_ref":null,"co_primary_endpoints":["rigor_non_inferiority","resolution_benefit"],"common_safety_overlay":{"commit":"ee8e265c2d4b5a661b7da667805b05e1a9e67a83","files":[{"path":"AGENTS.md","sha256":"sha256:bbc01628bec07dd64c9229e4314a513c161ad07c7e6606cbaae8d7f9856c747b"},{"path":"engagements/_TEMPLATE/scope.md","sha256":"sha256:2bfe520a65dbb7e65628b23d9a9d1f9b505a3688937d1929c438f5969f85b27d"},{"path":"engine/gates.md","sha256":"sha256:3950a267cf540d52f39ac174048052a3e0794bf3772aaa3ecb10f8bb05ec9386"},{"path":"skills/oracles/adjudication-oracle.md","sha256":"sha256:0c92317387a92d331fec3b5fd9dd71ede06ac4e32f0afbaf8ec755784ef0233a"}],"git_tree":"5266945506ca92efef2932f8563bbbfe836c384e","tree_hash":"sha256:5debeb216f72a1d923a1ed7b6510d7d4bfb841294673a5a0b5e16e0799ddca9c"},"contamination_rules":["Independent sessions, filesystems, target copies, and no shared notes.","Withhold findings, reports, PoCs, progress, case memory, and judge packets until outputs freeze."],"endpoint_definitions":{"resolution_minimum_effect":null,"rigor_non_inferiority_margin":0.0},"exclusion_rules":["Any historical case or lesson that informed Decision 0005.","Any case requiring shared live state or contact with an old target."],"execution_authorized":false,"exploratory":true,"inclusion_rules":["Sealed local known-truth cases not used to design Decision 0005.","Pinned target identity and hermetic signed scope available before assignment."],"lane":"sealed_known_truth","matching":{"call_budget":null,"filesystem_isolation":true,"model_provider_version":null,"model_runtime_hash":null,"session_isolation":true,"starting_information":"identical_recon_only","target_copy":"independent_per_arm","time_budget":null,"tool_runtime_hash":null,"tools":[]},"minimum_practical_effect":null,"no_peeking":true,"power_basis":"unavailable","root_cause_deduplication":["Deduplicate by mechanism, reachability boundary, and oracle-distinct root cause."],"safety":{"cleanup_required":true,"identical_root_gates":true,"operator_only_filing":true,"shared_live_state_forbidden":true,"zone2_fresh_confirmation":true},"safety_stops":["Stop on scope drift, identity drift, cleanup debt, secret-shaped content, or any Zone-2 step without fresh confirmation."],"sample_size":null,"schema_version":1,"secondary_endpoints":["persistence recovery","valid coverage closure","time and cost to resolution","human review burden","forced-resume correctness","report claim-to-proof completeness"],"status":"draft_not_authorized","study_evidence_ref":null,"study_id":"decision5-prospective-pilot-draft-v1","target_strata":[{"difficulty":"to_be_registered","domain":"to_be_registered","mode":"hermetic","size":"to_be_registered","truth_class":"unknown"}],"withheld_material_manifest_ref":null}
